{
  "$schema": "https://json-schema.org/draft/2020-12/schema",
  "title": "EconomicGrowthAdjustmentAudit",
  "type": "object",
  "required": ["parameter_records", "scenario_records", "growth_records", "interpretation_warning"],
  "properties": {
    "parameter_records": {"type": "array"},
    "scenario_records": {"type": "array"},
    "growth_records": {"type": "array"},
    "interpretation_warning": {"type": "string"}
  }
}
